{
  "$schema": "http://json-schema.org/draft-07/schema#",
  "$id": "ds/figma/components.schema.json",
  "title": "Code component <-> Figma node map",
  "description": "The running record of which code components have a Figma representation, and where. A component ABSENT from this map has no Figma representation yet — that absence is the signal, which is why entries are added when the work is done and never in advance.",
  "type": "object",
  "additionalProperties": false,
  "required": ["_schema", "lastScanned", "source", "components"],

  "properties": {
    "_schema": { "type": "string" },
    "_doc": { "type": "string" },
    "lastScanned": { "type": ["string", "null"] },
    "source": { "type": "string", "description": "A key in manifest.json -> sources." },
    "components": {
      "type": "object",
      "description": "Keyed by the code component name in PascalCase.",
      "additionalProperties": { "$ref": "#/definitions/componentEntry" }
    },
    "icons": {
      "type": "object",
      "description": "Optional. Icons are usually one component set with many variants rather than one entry each.",
      "additionalProperties": { "$ref": "#/definitions/entry" }
    }
  },

  "definitions": {
    "componentEntry": {
      "allOf": [
        { "$ref": "#/definitions/entry" },
        {
          "if": {
            "properties": { "assetType": { "enum": ["component_set", "component"] } },
            "required": ["assetType"]
          },
          "then": {
            "required": ["codePath"],
            "properties": { "codePath": { "type": "string", "minLength": 1 } }
          }
        }
      ]
    },
    "entry": {
      "type": "object",
      "additionalProperties": false,
      "required": ["source", "assetType"],
      "properties": {
        "source": { "type": "string", "description": "A key in manifest.json -> sources." },
        "codePath": {
          "type": ["string", "null"],
          "description": "Repo-relative path to the component's contract directory, e.g. packages/contracts/components/Button. Required and non-null for modelled entries under components; icon entries may have no component contract. verify:figma requires <Name>.contract.json when a path is present."
        },
        "pageId": {
          "type": ["string", "null"],
          "description": "EPHEMERAL. Source-file local; refreshable, never a durable join."
        },
        "componentSetId": { "type": ["string", "null"], "description": "EPHEMERAL. As above." },
        "componentId": { "type": ["string", "null"], "description": "EPHEMERAL. As above." },
        "componentKey": {
          "type": ["string", "null"],
          "description": "Publish-time stable key — the DURABLE join. Null until the source file is published as a library. Never rewrite a non-null key from a scan; a changed key means a different component, not a moved one."
        },
        "assetType": {
          "enum": ["component_set", "component", "not-modelled", null],
          "description": "`not-modelled` is the sentinel for a component deliberately not built in Figma. Put the reason in `note` — an empty entry reads as unfinished work."
        },
        "variantCount": { "type": ["integer", "null"], "minimum": 0 },
        "axes": {
          "type": "object",
          "description": "Figma variant properties that correspond to the contract's `axes`: TitleCase property, values exactly that axis's values. verify:figma asserts both directions — no axis the contract lacks, and no contract axis missing from a component set. A disagreement means the two surfaces describe different components.",
          "additionalProperties": { "type": "array", "items": { "type": "string" } }
        },
        "designAxes": {
          "type": "object",
          "description": "Figma-only visual-state properties that correspond to no contract axis, typically a State axis kept for review. Content axes and other non-contract variants are divergences, not designAxes. Whether a state has a public input behind it does not matter here: `disabled` does and `hover` does not, and both may appear. Each value, normalized (trimmed, lowercased, whitespace runs to '-'), must be a state the contract declares, one of a state's enumerated `values`, or `default` for the resting state. One axis flattens states the contract keeps independent — a tab can be selected and focused at once — so treat it as a review aid, not a model of the state space. verify:figma asserts all of this.",
          "additionalProperties": { "type": "array", "items": { "type": "string" } }
        },
        "dependsOn": {
          "type": "array",
          "items": { "type": "string" },
          "description": "DIRECT dependencies only — components instanced inside this one. Not transitive."
        },
        "generatedAt": { "type": ["string", "null"] },
        "note": { "type": "string" }
      }
    }
  }
}
